<?xml version="1.0" encoding="UTF-8"?>
<globalvariables
        xmlns:xsi="http://www.w3.org/2001/XMLSchema-instance"
        xmlns="urn:proactive:globalvariables:3.13" xsi:schemaLocation="urn:proactive:globalvariables:3.13 http://www.activeeon.com/public_content/schemas/proactive/globalvariables/3.13/globalvariables.xsd">
        <!-- Multiple filters can be added, to apply different set of global variables to different workflows -->
        <filter>
            <select>
                <!-- Xpath expressions are used to filter workflows affected by global variables.
                Example: to select workflows belonging to the basic-examples bucket
                <xpath><![CDATA[/job/genericInformation/info[@name='bucketName' and @value='basic-examples']]]></xpath>
                -->
                <xpath><![CDATA[.]]></xpath>
                <!-- more than one xpath expression can be added. In that case, global variables are applied when all xpath expressions match -->
            </select>
            <!-- add global variables or generic information below -->
            <variables>
            </variables>
            <genericInformation>
            </genericInformation>
        </filter>
        <filter>
            <select>
                <xpath><![CDATA[(/job/genericInformation/info[@name='bucketName' and (@value='ai-auto-ml-optimization' or @value='ai-machine-learning' or @value='ai-machine-learning-workflows' or @value='ai-deep-learning' or @value='ai-deep-learning-workflows' or @value='ai-federated-learning' or @value='ai-model-as-a-service' or @value='ai-data-visualization')])]]></xpath>
            </select>
            <variables>
                <variable name="NATIVE_SCHEDULER" value="" advanced="true" description="Name of the Native Scheduler node source to use when the workflow tasks must be deployed inside a cluster such as SLURM, LSF, etc." group="Resource Management" hidden="false" model="PA:MODEL_FROM_URL(${PA_SCHEDULER_REST_PUBLIC_URL}/rm/model/nodesources)"/>
                <variable name="NATIVE_SCHEDULER_PARAMS" value="" advanced="true" description="Parameters given to the native scheduler (SLURM, LSF, etc) while requesting a ProActive node used to deploy the workflow tasks." group="Resource Management" hidden="false"/>
                <variable name="NODE_ACCESS_TOKEN" value="" advanced="true" description="If not empty, the workflow tasks will be run only on nodes that contains the specified token." group="Resource Management" hidden="false" model="PA:MODEL_FROM_URL(${PA_SCHEDULER_REST_PUBLIC_URL}/rm/model/tokens)"/>
                <variable name="NODE_SOURCE_NAME" value="" advanced="true" description="If not empty, the workflow tasks will be run only on nodes belonging to the specified node source." group="Resource Management" hidden="false" model="PA:MODEL_FROM_URL(${PA_SCHEDULER_REST_PUBLIC_URL}/rm/model/nodesources)"/>
            </variables>
            <genericInformation>
                <info name="NODESOURCENAME" value="$NODE_SOURCE_NAME"/>
                <info name="NS" value="$NATIVE_SCHEDULER"/>
                <info name="NODE_ACCESS_TOKEN" value="$NODE_ACCESS_TOKEN"/>
                <info name="NS_BATCH" value="$NATIVE_SCHEDULER_PARAMS"/>
                <info name="PYTHON_COMMAND" value="python3"/>
            </genericInformation>
        </filter>
        <filter>
            <select>
                <xpath><![CDATA[(/job/genericInformation/info[@name='bucketName' and @value='service-automation']) and (/job/genericInformation/info[@name='pca.states' and @value='(VOID,RUNNING)'])]]></xpath>
            </select>
            <variables>
                <variable name="NATIVE_SCHEDULER" value="" advanced="true" description="Name of the Native Scheduler node source to use when the workflow tasks must be deployed inside a cluster such as SLURM, LSF, etc." group="Resource Management" hidden="false" model="PA:MODEL_FROM_URL(${PA_SCHEDULER_REST_PUBLIC_URL}/rm/model/nodesources)"/>
                <variable name="NATIVE_SCHEDULER_PARAMS" value="" advanced="true" description="Parameters given to the native scheduler (SLURM, LSF, etc) while requesting a ProActive node used to deploy the workflow tasks." group="Resource Management" hidden="false"/>
                <variable name="NODE_ACCESS_TOKEN" value="" advanced="true" description="If not empty, the workflow tasks will be run only on nodes that contains the specified token." group="Resource Management" hidden="false" model="PA:MODEL_FROM_URL(${PA_SCHEDULER_REST_PUBLIC_URL}/rm/model/tokens)"/>
                <variable name="NODE_SOURCE_NAME" value="" advanced="true" description="If not empty, the workflow tasks will be run only on nodes belonging to the specified node source." group="Resource Management" hidden="false" model="PA:MODEL_FROM_URL(${PA_SCHEDULER_REST_PUBLIC_URL}/rm/model/nodesources)"/>
            </variables>
            <genericInformation>
                <info name="NODESOURCENAME" value="$NODE_SOURCE_NAME"/>
                <info name="NS" value="$NATIVE_SCHEDULER"/>
                <info name="NODE_ACCESS_TOKEN" value="$NODE_ACCESS_TOKEN"/>
                <info name="NS_BATCH" value="$NATIVE_SCHEDULER_PARAMS"/>
                <info name="PYTHON_COMMAND" value="python3"/>
            </genericInformation>
        </filter>
        <filter>
            <select>
                <xpath><![CDATA[/job/genericInformation/info[@name='pca.states' and @value!='(VOID,RUNNING)']]]></xpath>
            </select>
            <variables>
            </variables>
            <genericInformation>
                <info name="NODESOURCENAME" value="$NODE_SOURCE_NAME"/>
                <info name="NS" value="$NATIVE_SCHEDULER"/>
                <info name="NS_BATCH" value="$NATIVE_SCHEDULER_PARAMS"/>
            </genericInformation>
        </filter>
</globalvariables>
